{
    "$schema": "http://json-schema.org/draft-07/schema#",
    "type": "object",
    "required": [ "skills", "enemies" ],
    "properties": {
        "enemies": {
            "type": "object",
            "required": [ "enemyList" ],
            "properties": {
                "enemyList": {
                    "type": "array",
                    "minItems": 1,
                    "items": {
                        "type": "integer",
                        "minimum": 1
                    }
                }
            }
        },
        "player": {
            "type": "object",
            "properties": {
                "modList": {
                    "type": "array",
                    "items": { "$ref": "#/definitions/mod" }
                }
            }
        },
        "skills": {
            "type": "object",
            "required": [ "skillList" ],
            "properties": {
                "skillList": {
                    "type": "array",
                    "items": {
                        "type": "object",
                        "required": [ "name", "attackSpeed", "manaCost", "baseDamageMultiplier", "levelReq" ],
                        "properties": {
                            "name": { "type": "string" },
                            "levelReq": { "type": "integer", "minimum": 1, "default": 1, "description": "Required player level\nNote - At least one skill must have a value of 1" },
                            "attackSpeed": { "type": "number", "minimum": 0.001, "maximum": 10, "default": 1, "description": "Number of attacks per second" },
                            "manaCost": { "type": "integer", "minimum": 0 },
                            "baseDamageMultiplier": { "type": "integer", "minimum": 1, "default": 100, "description": "A multiplier used to balance the skill. A value of 100 is 100% of base damage." },
                            "mods": {
                                "type": "array",
                                "items": { "$ref": "#/definitions/mod" }
                            }
                        }
                    }
                }
            }
        },
        "items": {
            "type": "object",
            "required": [ "itemList", "craftList", "modTables" ],
            "properties": {
                "itemList": {
                    "type": "array",
                    "items": {
                        "type": "object",
                        "properties": {
                            "name": { "type": "string" },
                            "levelReq": { "type": "integer", "minimum": 0 }
                        }
                    }
                },
                "craftList": {
                    "type": "array",
                    "minItems": 1,
                    "items": {
                        "type": "object",
                        "required": [ "id", "levelReq", "cost" ],
                        "properties": {
                            "id": {
                                "enum": [
                                    "reforge", "reforgeIncludePhysical", "reforgeIncludeCritical", "reforgeIncludeMana", "reforgeHigherChanceSameMods", "reforgeLowerChanceSameMods",
                                    "addRandom", "addPhysical", "addCritical", "addMana",
                                    "removeRandom", "removePhysical", "removeCritical", "removeMana",
                                    "removeRandomAddPhysical", "removeRandomAddCritical", "removeRandomAddMana" ]
                            },
                            "levelReq": { "type": "integer", "minimum": 0 },
                            "cost": { "type": "integer", "minimum": 0 }
                        }
                    }
                },
                "modTables": {
                    "type": "object",
                    "required": [ "general" ],
                    "properties": {
                        "general": {
                            "type": "array",
                            "items": {
                                "type": "array",
                                "items": {
                                    "type": "object",
                                    "required": [ "weight", "levelReq", "mod" ],
                                    "properties": {
                                        "weight": { "type": "integer", "minimum": 0 },
                                        "levelReq": { "type": "integer", "minimum": 0 },
                                        "mod": { "$ref": "#/definitions/mod" }
                                    }
                                }
                            }
                        }
                    }
                }
            }
        },
        "achievements": {
            "type": "object",
            "properties": {
                "list": {
                    "type": "array",
                    "items": {
                        "type": "object",
                        "required": [ "description" ],
                        "properties": {
                            "description": {
                                "type": "string",
                                "anyOf": [
                                    { "enum": [ "Reach Level {#}" ] }, { "pattern": "^Reach Level \\{\\d+\\}$" },
                                    { "enum": [ "Prestige {#}" ] }, { "pattern": "^Prestige \\{\\d+?\\}$" },
                                    { "enum": [ "Deal Damage {#}", "Deal Physical Damage {#}" ] }, { "pattern": "^Deal( Physical| Elemental)? Damage \\{\\d+\\}$" },
                                    { "enum": [ "Generate Gold {#}" ] }, { "pattern": "^Generate Gold \\{\\d+\\}$" },
                                    { "enum": [ "Regenerate Mana {#}" ] }, { "pattern": "^Regenerate Mana \\{\\d+\\}$" },
                                    { "enum": [ "Perform Hits {#}" ] }, { "pattern": "^Perform Hits \\{\\d+\\}$" },
                                    { "enum": [ "Perform Critical Hits {#} Total Critical Hits" ] }, { "pattern": "^Perform Critical Hits \\{\\d+\\}$" }
                                ]
                            },
                            "modList": {
                                "type": "array",
                                "description": "Each mod will be applied upon completing the achievement",
                                "items": {
                                    "$ref": "#/definitions/mod"
                                }
                            }
                        }
                    }
                }
            }
        },
        "prestige": {
            "type": "object",
            "required": [ "goldMultiplier" ],
            "properties": {
                "goldMultiplier": { "type": "integer", "default": 20, "description": "Each prestige will apply this multiplier to gold per second" }
            }
        }
    },
    "definitions": {
        "mod": {
            "type": "string",
            "oneOf": [
                { "enum": [ "Adds {#} To {#} Physical Damage" ] }, { "pattern": "^Adds \\{(\\d+(\\.\\d+)?)(-\\d+(\\.\\d+)?)?\\} To \\{(\\d+(\\.\\d+)?)(-\\d+(\\.\\d+)?)?\\} Physical Damage$" },
                { "enum": [ "{#}% Increased Physical Damage" ] }, { "pattern": "^\\{(\\d+(\\.\\d+)?)(-\\d+(\\.\\d+)?)?\\}% Increased Physical Damage$" },
                { "enum": [ "{#}% More Physical Damage" ] }, { "pattern": "^\\{(\\d+(\\.\\d+)?)(-\\d+(\\.\\d+)?)?\\}% More Physical Damage$" },
                { "enum": [ "{#}% More Damage" ] }, { "pattern": "^\\{(\\d+(\\.\\d+)?)(-\\d+(\\.\\d+)?)?\\}% More Damage Damage$" },
                { "enum": [ "+{#}% Hit Chance" ] }, { "pattern": "^\\+\\{(\\d+(\\.\\d+)?)(-\\d+(\\.\\d+)?)?\\}% Hit Chance$" },
                { "enum": [ "{#}% Increased Attack Speed" ] }, { "pattern": "^\\{(\\d+(\\.\\d+)?)(-\\d+(\\.\\d+)?)?\\}% Increased Attack Speed$" },
                { "enum": [ "+{#}% Critical Hit Chance" ] }, { "pattern": "^\\+\\{(\\d+(\\.\\d+)?)(-\\d+(\\.\\d+)?)?\\}% Critical Hit Chance$" },
                { "enum": [ "+{#}% Critical Hit Multiplier" ] }, { "pattern": "^\\+\\{(\\d+(\\.\\d+)?)(-\\d+(\\.\\d+)?)?\\}% Critical Hit Multiplier$" },
                { "enum": [ "+{#} Maximum Mana" ] }, { "pattern": "^\\+\\{(\\d+(\\.\\d+)?)(-\\d+(\\.\\d+)?)?\\} Maximum Mana$" },
                { "enum": [ "+{#}% Increased Maximum Mana" ] }, { "pattern": "^\\{(\\d+(\\.\\d+)?)(-\\d+(\\.\\d+)?)?\\}% Increased Maximum Mana$" },
                { "enum": [ "+{#} Mana Regeneration" ] }, { "pattern": "^\\+\\{(\\d+(\\.\\d+)?)(-\\d+(\\.\\d+)?)?\\} Mana Regeneration$" },
                { "enum": [ "+{#} Gold Per Second" ] }, { "pattern": "^\\+\\{(\\d+(\\.\\d+)?)(-\\d+(\\.\\d+)?)?\\} Gold Per Second$" }
            ]
        }
    }
}
